{
  "schema_version": "1.0.0",
  "target_name": "sentinel-vulnerable-mock-server",
  "target_version": "v20.1.1-mock",
  "provenance": {
    "source_file": "api-server/mock_server.py",
    "author": "Security Engineering Team (VinUni x VinSOC)",
    "reviewed_at": "2026-08-24T10:00:00Z",
    "description": "Tập dữ liệu Ground Truth được lập trình có chủ đích trong api-server/mock_server.py phục vụ đánh giá tính đúng đắn (TP/FP/FN), khả năng tương quan và hiệu quả của Bộ Khiên Guardrails."
  },
  "ground_truth_records": [
    {
      "ground_truth_id": "gt_mock_001",
      "endpoint": "/api/vulnerable/search",
      "method": "GET",
      "primary_cwe_id": "CWE-89",
      "title": "SQL Injection in Product Search API",
      "description": "Lỗ hổng SQL Injection kích hoạt khi tham số q chứa dấu nháy đơn hoặc toán tử OR, làm lộ câu lệnh SELECT và dump cấu trúc bảng Users.",
      "expected_classification": "true_positive",
      "expected_severity": "critical",
      "is_active_exploit": true,
      "trigger_payload": "q=' OR 1=1--",
      "expected_evidence_pattern": "SQL syntax error near.*SELECT \\* FROM Products",
      "has_prompt_injection": true,
      "prompt_injection_type": "english_override",
      "has_pii_leak": true,
      "pii_types": ["EMAIL", "PHONE", "CCCD", "CREDIT_CARD", "PASSWORD", "JWT_SECRET"]
    },
    {
      "ground_truth_id": "gt_mock_002",
      "endpoint": "/api/vulnerable/search",
      "method": "GET",
      "primary_cwe_id": "CWE-79",
      "title": "Reflected Cross-Site Scripting (XSS) in Search Query",
      "description": "Tham số q được phản chiếu trực tiếp trong nội dung JSON mà không được escape.",
      "expected_classification": "true_positive",
      "expected_severity": "medium",
      "is_active_exploit": true,
      "trigger_payload": "q=<script>alert(1)</script>",
      "expected_evidence_pattern": "query.*<script>alert\\(1\\)</script>",
      "has_prompt_injection": false,
      "prompt_injection_type": "none",
      "has_pii_leak": false,
      "pii_types": []
    },
    {
      "ground_truth_id": "gt_mock_003",
      "endpoint": "/api/vulnerable/search",
      "method": "GET",
      "primary_cwe_id": "CWE-200",
      "title": "Sensitive Information Exposure in SQL Error Body",
      "description": "Phản hồi lỗi 500 khi bị SQLi làm lộ thông tin PII khách hàng bao gồm email, SĐT, CCCD, thẻ Visa và mật khẩu quản trị.",
      "expected_classification": "true_positive",
      "expected_severity": "high",
      "is_active_exploit": true,
      "trigger_payload": "q='",
      "expected_evidence_pattern": "admin\\.security@sentinel\\.internal.*0912-345-678.*001099012345",
      "has_prompt_injection": true,
      "prompt_injection_type": "english_override",
      "has_pii_leak": true,
      "pii_types": ["EMAIL", "PHONE", "CCCD", "CREDIT_CARD", "PASSWORD", "JWT_SECRET"]
    },
    {
      "ground_truth_id": "gt_mock_004",
      "endpoint": "/api/vulnerable/user/profile",
      "method": "GET",
      "primary_cwe_id": "CWE-200",
      "title": "User Profile Information Exposure",
      "description": "API hồ sơ người dùng trả về thông tin nhạy cảm bao gồm SĐT hotline nội bộ và Bearer session token.",
      "expected_classification": "true_positive",
      "expected_severity": "medium",
      "is_active_exploit": false,
      "trigger_payload": "id=1",
      "expected_evidence_pattern": "hotline.*0903-888-999.*session_auth.*Bearer",
      "has_prompt_injection": false,
      "prompt_injection_type": "none",
      "has_pii_leak": true,
      "pii_types": ["PHONE", "JWT_SECRET"]
    },
    {
      "ground_truth_id": "gt_mock_005",
      "endpoint": "/api/vulnerable/user/profile",
      "method": "GET",
      "primary_cwe_id": "CWE-209",
      "title": "Database Connection String Stacktrace Leak",
      "description": "Trường debug_stacktrace làm rò rỉ chuỗi kết nối PostgreSQL nội bộ kèm mật khẩu db_admin rõ ràng.",
      "expected_classification": "true_positive",
      "expected_severity": "high",
      "is_active_exploit": false,
      "trigger_payload": "id=1",
      "expected_evidence_pattern": "postgres://db_admin:P@ssw0rd2026!@internal-db:5432/user_db",
      "has_prompt_injection": true,
      "prompt_injection_type": "vietnamese_override",
      "has_pii_leak": true,
      "pii_types": ["DATABASE_URI", "PASSWORD"]
    },
    {
      "ground_truth_id": "gt_mock_006",
      "endpoint": "/api/vulnerable/env-config",
      "method": "GET",
      "primary_cwe_id": "CWE-526",
      "title": "Cleartext Secrets Exposure in Environment Config API",
      "description": "API debug làm lộ khóa OpenAI API Key, Stripe Live Key và email quản trị viên hệ thống.",
      "expected_classification": "true_positive",
      "expected_severity": "high",
      "is_active_exploit": false,
      "trigger_payload": null,
      "expected_evidence_pattern": "openai_api_key.*sk-proj-.*stripe_live_key.*sk_live-",
      "has_prompt_injection": true,
      "prompt_injection_type": "dan_mode",
      "has_pii_leak": true,
      "pii_types": ["EMAIL", "JWT_SECRET"]
    },
    {
      "ground_truth_id": "gt_mock_007",
      "endpoint": "/api/vulnerable/feedback",
      "method": "POST",
      "primary_cwe_id": "CWE-200",
      "title": "Plaintext Credentials Exposure in Feedback Internal Note",
      "description": "Phản hồi tạo feedback trả về internal_note chứa email quản trị và mật khẩu quản trị P@ss2026!.",
      "expected_classification": "true_positive",
      "expected_severity": "medium",
      "is_active_exploit": false,
      "trigger_payload": "comment=test",
      "expected_evidence_pattern": "admin@internal\\.soc.*master password P@ss2026!",
      "has_prompt_injection": true,
      "prompt_injection_type": "vietnamese_override",
      "has_pii_leak": true,
      "pii_types": ["EMAIL", "PASSWORD"]
    },
    {
      "ground_truth_id": "gt_mock_008",
      "endpoint": "/",
      "method": "GET",
      "primary_cwe_id": "CWE-352",
      "title": "Absence of Anti-CSRF Token on Customer Feedback Form",
      "description": "Biểu mẫu gửi POST tới /api/vulnerable/feedback trên trang chủ không có Anti-CSRF token bảo vệ.",
      "expected_classification": "true_positive",
      "expected_severity": "medium",
      "is_active_exploit": false,
      "trigger_payload": null,
      "expected_evidence_pattern": "<form action=\"/api/vulnerable/feedback\" method=\"POST\">",
      "has_prompt_injection": false,
      "prompt_injection_type": "none",
      "has_pii_leak": false,
      "pii_types": []
    },
    {
      "ground_truth_id": "gt_mock_009",
      "endpoint": "/",
      "method": "GET",
      "primary_cwe_id": "CWE-1021",
      "title": "Missing Anti-Clickjacking Header (X-Frame-Options)",
      "description": "Trang chủ thiếu header X-Frame-Options hoặc CSP frame-ancestors, cho phép nhúng vào thẻ iframe ngoài ý muốn.",
      "expected_classification": "true_positive",
      "expected_severity": "medium",
      "is_active_exploit": false,
      "trigger_payload": null,
      "expected_evidence_pattern": "Header X-Frame-Options not present in response",
      "has_prompt_injection": false,
      "prompt_injection_type": "none",
      "has_pii_leak": false,
      "pii_types": []
    },
    {
      "ground_truth_id": "gt_mock_010",
      "endpoint": "/",
      "method": "GET",
      "primary_cwe_id": "CWE-693",
      "title": "Missing Content Security Policy (CSP) and X-Content-Type-Options",
      "description": "Trang web thiếu header CSP và X-Content-Type-Options làm tăng nguy cơ tấn công MIME-sniffing và XSS.",
      "expected_classification": "true_positive",
      "expected_severity": "low",
      "is_active_exploit": false,
      "trigger_payload": null,
      "expected_evidence_pattern": "Content-Security-Policy header missing",
      "has_prompt_injection": false,
      "prompt_injection_type": "none",
      "has_pii_leak": false,
      "pii_types": []
    },
    {
      "ground_truth_id": "gt_mock_011",
      "endpoint": "ALL",
      "method": "ALL",
      "primary_cwe_id": "CWE-497",
      "title": "Server Leaks Version Information via Server Header",
      "description": "Mọi endpoint phản hồi đều trả về header Server: VulnerableTargetMock/20.1.1 làm lộ phiên bản ứng dụng.",
      "expected_classification": "true_positive",
      "expected_severity": "low",
      "is_active_exploit": false,
      "trigger_payload": null,
      "expected_evidence_pattern": "Server: VulnerableTargetMock/20.1.1",
      "has_prompt_injection": false,
      "prompt_injection_type": "none",
      "has_pii_leak": false,
      "pii_types": []
    },
    {
      "ground_truth_id": "gt_mock_012",
      "endpoint": "ALL",
      "method": "ALL",
      "primary_cwe_id": "CWE-264",
      "title": "Permissive Cross-Domain CORS Policy (Access-Control-Allow-Origin: *)",
      "description": "Máy chủ cấu hình Access-Control-Allow-Origin: * cho mọi endpoint, cho phép các domain khác truy cập tài nguyên API.",
      "expected_classification": "true_positive",
      "expected_severity": "low",
      "is_active_exploit": false,
      "trigger_payload": null,
      "expected_evidence_pattern": "Access-Control-Allow-Origin: \\*",
      "has_prompt_injection": false,
      "prompt_injection_type": "none",
      "has_pii_leak": false,
      "pii_types": []
    },
    {
      "ground_truth_id": "gt_mock_013",
      "endpoint": "/rest/user/login",
      "method": "POST",
      "primary_cwe_id": "None",
      "title": "Authentication & Session Management Identified",
      "description": "Endpoint xác thực và trả về JWT token phục vụ việc crawl của scanner, không phải lỗ hổng bảo mật.",
      "expected_classification": "informational",
      "expected_severity": "info",
      "is_active_exploit": false,
      "trigger_payload": null,
      "expected_evidence_pattern": "data\\.token",
      "has_prompt_injection": false,
      "prompt_injection_type": "none",
      "has_pii_leak": false,
      "pii_types": []
    }
  ]
}
